Level,Question,Answer
1,Question: What are the key benefits of the Farmer’s Handbook on Basic Agriculture as outlined in the document?,"Answer: The Farmer’s Handbook on Basic Agriculture, compiled by Dr. P, offers several key benefits aimed at enhancing the livelihoods of farmers through scientific agriculture. Firstly, it provides farmers with technical knowledge in a user-friendly format, incorporating simple language, practical examples, and visual aids to ensure the information is accessible and understandable. This approach is designed to bridge the knowledge gap and empower farmers with the information necessary for making informed decisions about their agricultural practices.

The handbook covers a wide range of topics across its six chapters, focusing on essential aspects of agriculture that include baseline situation assessments, the importance of adopting improved farming technologies, and the integration of market opportunities. A significant benefit highlighted is the potential for increased income levels among farmers who have access to and implement technical knowledge, particularly those engaged in partnership farming. This is supported by a study in Gujarat and Maharashtra, which showed that farmers knowledgeable about practices such as soil testing and those who adopted modern farming techniques like mulching, intercropping, and fertigation saw better financial outcomes.

Moreover, the handbook serves as a comprehensive guide for farm management, setting objectives that encourage farmers to leverage technology and market opportunities to boost their income, plan production for food security, and engage professionally with various stakeholders in the agricultural sector. It emphasizes the dynamic nature of farm technologies and the importance of farming as a business, advising on the selection of crop varieties, minimizing input costs, enhancing production, and planning for market-driven production among other strategies.

In essence, the Farmer’s Handbook on Basic Agriculture provides a foundational resource for farmers to improve their agricultural practices, manage their farms more effectively, and achieve better economic and production outcomes."
1,"Question: What is the primary goal of the handbook discussed in the document, and how does it propose to address the challenges facing modern agriculture?","Answer: The primary goal of the handbook outlined in the document is to serve as a comprehensive resource for farmers and stakeholders in the agricultural sector, aiming to address modern agricultural practices and challenges. It proposes to meet the anticipated higher demand for agricultural raw materials by shifting the perspective of agriculture from merely producing and selling farm products at local markets to embracing a broader view. This includes incorporating advanced agricultural disciplines such as agronomy, agricultural economics, soil science, plant pathology, entomology, and extension education. By doing so, the handbook seeks to equip those involved in agriculture with the knowledge and tools needed to adapt to and thrive in the changing agricultural landscape, emphasizing sustainable practices and international cooperation."
1,"Question: What are the key components of Integrated Pest Management (IPM) as outlined in the document, and how do they contribute to sustainable agriculture?","Answer: The key components of Integrated Pest Management (IPM) as outlined in the document include the adoption of organic control practices, the application of pest and disease forecasting techniques, the consideration of all possible methods for pest control and their implications on farm productivity and the environment, and the detailed guidelines for the storage and use of agrochemicals to ensure they are applied by trained personnel according to legal requirements. These components contribute to sustainable agriculture by minimizing the reliance on chemical pesticides, reducing the potential for environmental damage, and promoting practices that maintain soil health and biodiversity. By focusing on a comprehensive approach that includes monitoring pest loads, using precision farming technologies, and adhering to Good Agriculture Practices (GAP), IPM aims to enhance farm profitability while ensuring the long-term viability of agricultural lands. The emphasis on education, monitoring, and the use of scientific and indigenous knowledge further supports the sustainable management of pests and diseases, aligning with broader goals of environmental stewardship and sustainable development."
1,"Question: How does the ""Partnership Farming India"" (PFI) project aim to address the challenges faced by farmers and agricultural enterprises in India, and what are its key components?","Answer: The ""Partnership Farming India"" (PFI) project, initiated by Desai Fruits and Vegetables (DFV) in cooperation with the Deutsche Gesellschaft für Internationale Zusammenarbeit (GIZ) GmbH and supported by the German Federal Ministry for Economic Cooperation and Development (BMZ), aims to address the challenges faced by farmers and agricultural enterprises in India by empowering farmers and farm workers in Gujarat and Maharashtra. The project focuses on enhancing their management skills, adopting modern agricultural practices, and improving the international competitiveness of their produce. Key components of the PFI project include providing access to practical agricultural education, thereby transforming participants into self-sufficient decision-makers and ""agripreneurs."" This is facilitated through the collaboration with the National Institute of Agricultural Extension Management (MANAGE), which has led to the development of training materials on basic agricultural knowledge and skills. The initiative aspires to establish a model for long-term, successful, and trustful business relationships that integrate small-scale production with large-scale processing and marketing, aiming to create a replicable model for sustainable agriculture and the prosperity of farmers."
1,Question: What are the key roles of agriculture in the Indian economy as outlined in the document?,"Answer: The document outlines several key roles of agriculture in the Indian economy, emphasizing its critical importance as a primary source of income for over half of the population. It highlights the essential function of research and extension systems in generating and disseminating agricultural technologies to increase farmers' income. These systems employ various methods, including training, demonstrations, and exposure visits, to transfer technologies from laboratories to the field. The focus is mainly on developing and implementing location and crop-specific technologies on a solution-to-problem basis. Additionally, the document discusses the need to equip farmers with basic agricultural knowledge to enhance their decision-making capabilities and their ability to adopt modern technologies, thereby further underlining the pivotal role of agriculture in supporting the economy and livelihoods in India."
1,"Question: What is the primary goal of The Farmer's Handbook on Basic Agriculture, and which organizations are involved in its creation?","Answer: The primary goal of The Farmer's Handbook on Basic Agriculture is to impart technical knowledge on basic agriculture to farmers, aiming to provide them with a comprehensive perspective on scientific agriculture. This initiative is a collaborative effort involving several organizations, including DFV India and the Deutsche Gesellschaft für Internationale Zusammenarbeit (GIZ) GmbH, acting on behalf of the German Federal Ministry for Economic Cooperation and Development (BMZ). It also involves close cooperation with the National Institute of Agricultural Extension Management (MANAGE), an organization under the Ministry of Agriculture, Government of India. Additionally, the project highlights the importance of disseminating technologies through public-private partnerships, involving various commodity boards and national institutes such as the Coffee Board, Rubber Board, Spice Board, Tea Board, Coconut Development Board, Tobacco Board, Silk Board, Cotton Corporation of India, and several national institutes including MANAGE, the Central Food and Technology Research Institute (CFTRI), the Defence Research and Development Organisation (DRDO), the National Institute of Plant Health Management (NIPHM), the National Institute of Agricultural Marketing (NIAM), the National Horticulture Mission (NHM), and the National Horticulture Board (NHB). Key personnel involved in this project include Chandra Shekara from MANAGE, Mrs. Sabine Preuss, Programme Director of Natural Resource Management at GIZ, and Mr. Rajiv Ahuja, Technical Expert of Natural Resource Management Programme at GIZ."
1,Question: What are the key factors that the documentation suggests farmers should consider when selecting crops and cropping systems?,"Answer: The documentation suggests that farmers should consider several key factors when selecting crops and cropping systems to ensure successful cultivation and profitability. These factors include the availability of electricity for water lifting, the presence of pump sets and micro-irrigation systems, and a thorough understanding of cropping systems management. It also emphasizes the importance of considering the economic viability and risk management strategies of different crops and cropping systems, taking into account the economic conditions of the farmers such as landholding size, financial resources, labor availability, and the potential for mechanization. Additionally, the guide urges farmers to assess technology availability and suitability for the proposed crop or cropping system, market demand, and the availability of market infrastructure. It also highlights the significance of having a clear understanding of the market, including where, when, and to whom to sell the produce, as well as considering technologies for value addition and market linkages for value-added products."
1,"Question: What are the key benefits of implementing Integrated Nutrient Management (INM) strategies in sustainable agriculture as outlined in the second chapter titled ""Soil and Plant Nutrition""?","Answer: The key benefits of implementing Integrated Nutrient Management (INM) strategies in sustainable agriculture, as outlined in the documentation, include achieving efficient, economical, and sustainable crop production. INM emphasizes the use of both organic and inorganic fertilizers in a balanced manner, which helps in maintaining soil fertility and enhancing its physical, chemical, and biological properties. This approach not only ensures the optimal growth and nutrition of plants but also minimizes the environmental impact of farming by reducing dependency on chemical fertilizers. Furthermore, INM practices contribute to increased productivity and income for farmers by ensuring that nutrients are provided to the crops in the most efficient way. By adopting INM, farmers can achieve the desired yield while also conserving soil health for future generations, making it a critical approach for sustainable agriculture."
1,"Question: What are the key components of Integrated Pest Management (IPM) as discussed in the third chapter, and how does it contribute to the safety and health of farmers?","Answer: The key components of Integrated Pest Management (IPM) as discussed in the third chapter include enhancing farmers' awareness and understanding of crop pests, diseases, and weed management. IPM emphasizes the safe handling of chemicals and plant protection equipment, aiming to minimize the risks associated with pesticide use. By focusing on a comprehensive approach to pest management, IPM contributes to the safety and health of farmers by reducing their exposure to harmful chemicals and promoting practices that are less hazardous to their health. This approach not only helps in managing pests more effectively but also in safeguarding farmers' health by advocating for the use of safer alternatives and protective measures during pesticide application. Additionally, the chapter on ""Occupational Health and Safety of Farmers"" further elaborates on the importance of safety in handling chemicals, providing farmers with knowledge on preventive measures, first aid for health hazards, and safety tips to reduce the risk of injuries and fatalities. This comprehensive approach to pest management and farmer safety underscores the importance of IPM in promoting sustainable farming practices that prioritize the health and well-being of farmers."
1,Question: How does leveraging Information & Communication Technologies (ICT) benefit farmers in accessing extension services and other agricultural resources?,"Answer: Leveraging Information & Communication Technologies (ICT) significantly benefits farmers by providing them with easier and more efficient access to a wide range of extension services, agricultural resources, and vital information. ICT tools, such as mobile applications, websites, and SMS-based services, enable farmers to obtain real-time market information, which is crucial for making informed decisions regarding crop selection, timing for selling produce, and understanding market fluctuations. These technologies also facilitate direct communication with extension workers, agricultural experts, and service providers, thereby enhancing farmers' knowledge on best practices, new technologies, and innovative farming techniques. Furthermore, ICT can help farmers access financial services, including agricultural credit and insurance, and understand legal aspects relevant to their operations. By improving access to information and services, ICT empowers farmers to increase their production, ensure food security, and improve their income through better market opportunities."
1,Question: What role does the Agricultural Technology Management Agency (ATMA) play in agricultural development according to the Farmer's Handbook on Basic Agriculture?,"Answer: The Agricultural Technology Management Agency (ATMA) plays a pivotal role in agricultural development at the district level as outlined in the Farmer's Handbook on Basic Agriculture. It is responsible for coordinating agricultural and allied departments along with the private sector to foster agricultural growth. ATMA's duties include organizing various extension activities such as field visits, trainings, demonstrations, and farmer-scientist interactions. These activities are aimed at promoting the adoption of new technologies and practices among farmers to improve agricultural productivity and sustainability. Additionally, ATMA focuses on disseminating extension information through both print and electronic media, ensuring that farmers receive timely alerts about agricultural operations and necessary precautions. This comprehensive approach by ATMA is crucial for enhancing the effectiveness of agricultural extension services and supporting the overall development of the agricultural sector at the district level."
1,"Question: How does access to agricultural information impact the yields and net incomes of farmers according to the study, and what are the specific figures for banana cultivation?","Answer: According to the study, farmers who accessed agricultural information from universities and magazines (treatment group) experienced significantly higher yields and net incomes compared to those who did not have access to such information (control group). Specifically, for banana cultivation, the treatment group achieved an average yield of 35.65 tons per acre, which was notably higher than the 22.36 tons per acre yield of the control group. In terms of financial outcomes, the average net income for farmers in the treatment group was Rs 93,822, compared to Rs 81,659 for those in the control group. This data underscores the positive impact that access to agricultural information can have on both the productivity and economic returns of farming activities."
1,Question: What are the key factors that contribute to enhancing farm profitability according to the documentation?,"Answer: According to the documentation, enhancing farm profitability hinges on several key factors. Firstly, it emphasizes the importance of bridging the knowledge gap among farmers, as a better understanding of farm management correlates with higher profits. Comprehensive farm management is crucial, which involves a thorough understanding of various resources such as land, irrigation, labor, livestock, farm machinery, seeds, fertilizers, credit, and market demand, as well as infrastructure like cold storage and godowns. Additionally, the documentation highlights the need for farmers to make informed decisions regarding the skill, knowledge, and attitude of labor towards agricultural practices and technology. In terms of livestock management, selecting the right breed, understanding its production capacity and adaptability to the local environment, and its drafting capacity are essential. These factors, when addressed collectively, are presented as vital for farmers aiming to enhance their net income and overall farm profitability."
1,Question: What are the primary objectives of implementing Good Agricultural Practices (GAP) codes and standards in agriculture?,"Answer: The primary objectives of implementing Good Agricultural Practices (GAP) codes and standards in agriculture include ensuring the safety and quality of produce within the food chain, capturing new market advantages by altering supply chain governance, and improving the use of natural resources as well as the health and working conditions of farm workers. These objectives aim to provide a framework for sustainable farming practices that lead to the production of safe and quality agricultural products, while also opening up new market opportunities for farmers and exporters, particularly in developing countries. Through adherence to GAP standards, farmers can achieve easier access to markets, enhance food quality and safety, and reduce the risks of non-compliance with regulations on pesticides, Maximum Residue Limits (MRLs), and other potential contaminants."
1,Question: What are the key factors that farmers need to consider when selecting crops and cropping patterns according to the document?,"Answer: According to the document, farmers need to consider a variety of key factors when selecting crops and cropping patterns to ensure sustainable and profitable farming. These factors include climatic conditions such as monsoon, temperature, rainfall, and seasons, which directly impact agriculture. Soil health and water availability are also crucial, as they determine the suitability of certain crops and cropping systems. The document emphasizes the importance of understanding basic seed knowledge, cropping systems, mechanization, and Good Agricultural Practices (GAP). Additionally, it highlights the need to adapt to changing climatic conditions by innovating and adopting suitable technologies, changing cropping patterns, and integrating farming systems. Economic conditions, mechanization potential, technology availability, market demand, and the availability of agricultural inputs and support services are also listed as critical considerations. By taking into account these factors, farmers can make informed decisions that contribute to sustainable agriculture and improved livelihoods."
1,Question: What are the main sources of agricultural knowledge and support for farmers as discussed in the document?,"Answer: The document identifies several key sources of agricultural knowledge and support for farmers. These include agricultural articles in newspapers, input dealers, agribusiness companies, NGOs, agriclinics, and agribusiness centers. It emphasizes the importance of a robust support network that includes both information dissemination and the provision of agricultural inputs such as seeds, fertilizers, pesticides, implements, and credit. Additionally, the document highlights the role of post-harvest storage and processing technologies in enhancing farm profitability. Input dealers, often village-level businessmen, play a crucial role by selling inputs and offering extension advisories, despite not being professionally qualified extension functionaries. Some input dealers improve their advisory capacity through programs like the Diploma in Agricultural Extension Service for Input Dealers (DAESI). Furthermore, the document suggests that farmers can seek advisory services from local public extension functionaries and obtain inputs based on these advisories, indicating a collaborative approach to accessing agricultural support and information."
1,Question: How does climate change affect the incidence of pests and diseases in agriculture and livestock?,"Answer: Climate change, through increased temperatures and altered rainfall patterns, significantly impacts the incidence of pests and diseases in both agriculture and livestock. In agriculture, higher temperatures and changes in humidity can lead to an increase in the prevalence of sucking pests such as mites and leaf miners, while altered rainfall patterns may result in a rise in pests and diseases like bollworm and leaf spot. These climatic changes can shift pest and disease dynamics, potentially transforming minor pests into major threats. For livestock, the expansion of vector populations due to warmer climates can lead to larger outbreaks of vector-borne diseases. Additionally, increased temperatures and water scarcity can negatively affect the health and nutrition of animals, further exacerbating the challenges posed by pests and diseases."
1,Question: How is climate change expected to impact water availability in India's major rivers like the Ganga and Brahmaputra in the short and long term?,"Answer: In the short term, climate change is expected to increase water availability in India's major rivers such as the Ganga and Brahmaputra and their tributaries due to the melting of Himalayan glaciers. This initial increase in water flow could potentially support agriculture and water supply for a period. However, in the long term, as the glaciers continue to recede, the water availability in these rivers is expected to decrease significantly. This reduction in water flow will pose serious challenges to water supply for agriculture, drinking, and other uses, exacerbating the issues related to water scarcity in the region."
1,Question: What are the key benefits of zero tillage farming as outlined in the document?,"Answer: Zero tillage farming, as highlighted in the document, offers several key benefits including effective erosion control, enhanced moisture conservation, higher nitrogen availability in the soil, and better protection for seedlings. These advantages contribute to maintaining or even increasing crop yields compared to traditional tillage systems, making zero tillage a sustainable and efficient agricultural practice."
1,"Question: What are the primary causes of soil and water degradation mentioned in the documentation, and how do different soil types affect erosion susceptibility?","Answer: The primary causes of soil and water degradation identified in the documentation are water and wind erosion, with unmanaged runoff being the principal cause of water erosion. Runoff is significantly influenced by climatic conditions, watershed characteristics, and the presence of barren land without vegetation. Regarding the susceptibility of different soil types to erosion, sandy soils are highly susceptible to erosion under high-intensity rainfall due to their low binding capacity, making them prone to being washed away. On the other hand, clay soils, despite their high water holding capacity, are prone to runoff on moderate and steep slopes during ordinary rains because of their compact nature, which can prevent water from infiltrating easily. Silt loam, loamy, and fine sandy loam soils are considered more desirable for minimizing soil erosion due to their balanced texture, which supports better water infiltration and reduces runoff, thereby decreasing the risk of erosion."
1,Question: What are the key benefits of implementing good agricultural practices as outlined in the document?,"Answer: The key benefits of implementing good agricultural practices, as outlined in the document, include reduced labor and savings on equipment and fuel costs, increased water and organic matter availability through mulching, reduced erosion, and enhanced environmental protection. These practices lead to less drought susceptibility, improved soil quality, and minimized dependency on external inputs. Additionally, the document highlights the importance of irrigation in conserving water and soil, efficient water use, labor savings, early seed germination, fertigation, soil amendments, and frost protection. Mechanization is emphasized for ensuring timely field operations, effective application of inputs, and reducing drudgery. Integrated Farming Systems (IFS) are mentioned as a holistic approach to farming that can further enhance the efficiency and sustainability of agricultural operations. Adopting these practices can improve market competitiveness and pricing of agricultural produce."
