Level,Question,Answer
1,Question: What are the key components that should be included in a farmer's first-aid kit according to the documentation?,"Answer: According to the documentation, a farmer's first-aid kit should include key components such as sterile adhesive bandages, absorbent cotton pads, adhesive tape, triangular and roller bandages, cotton rolls, band-aids, scissors, a pen torch, latex gloves, tweezers, a needle, moistened towels, clean dry cloth pieces, antiseptic solutions like Savlon or Dettol, a thermometer, petroleum jelly, assorted sizes of safety pins, cleansing agents, soap, and non-prescription drugs. The non-prescription drugs should include aspirin or paracetamol for pain relief, antidiarrhea medication, antihistamine cream for bee stings, antacid for stomach upset, and laxatives. This comprehensive list ensures that the first-aid kit is well-equipped to handle a variety of common injuries and health issues that may occur in a farming environment."
1,Question: What are the key financial support mechanisms available to farmers as outlined in the documentation?,"Answer: The key financial support mechanisms available to farmers, as outlined in the documentation, include a variety of credit schemes, insurance options, and information dissemination channels. These mechanisms are facilitated through cooperative societies such as District Central Cooperative banks and Primary Societies, which play a significant role in extending agriculture credits under the priority sector and implementing schemes by NABARD and the government. Land Development Banks offer medium and long-term credit to agriculture. Public sector extension services and Matured Common Interest Groups (CIGs) provide crucial information and resources for accessing collective resources, including credit and market linkages. Financial services for farmers are accessible through Self Help Groups (Micro Finance Institutions), nationalized and private banks, cooperative banks and societies, and subsidy schemes from State/Central Governments. The Kisan Credit Card Scheme (KCC) is particularly highlighted for offering timely financial support for short-term credit needs, with benefits such as assured credit availability and a repayment schedule aligned with harvest cycles. Additionally, the Personal Accident Insurance Package for KCC holders offers coverage against accidents and permanent disabilities. Credit support is also extended by nationalized banks, the Bank-SHG Linkage Programme, and Commodity Boards, while agricultural insurance is provided by the Agricultural Insurance Corporation Ltd (AIC) and other agencies to protect farmers against uncertainties. Lastly, important sources of agricultural information include the Kisan Call Center, Krishi Vigyan Kendra, Agricultural Universities, and ICAR Institutions, which are crucial for the dissemination of information and support to farmers."
1,Question: What are the primary functions of Krishi Vigyan Kendra (KVK) as outlined in the documentation?,"Answer: The primary functions of Krishi Vigyan Kendra (KVK) include offering advisory services by professionals fluent in local languages, organizing front-line demonstrations, exposure visits, training programs, exhibitions, and field days to educate and empower farmers. They also distribute agricultural literature to enhance farmers' knowledge and understanding. Additionally, some KVKs provide input support to farmers, supplying them with essential resources for farming. These activities are aimed at addressing agricultural issues relevant to specific locales, with a multidisciplinary team of experts dedicated to improving agricultural practices and outcomes."
2,"Question: What are the key objectives of the Farmer's Handbook on Basic Agriculture as compiled by Dr. P and outlined by B. Srinivas, IAS?","Answer: The key objectives of the Farmer's Handbook on Basic Agriculture are to enhance agricultural productivity and income levels among farmers by disseminating scientific knowledge and practical guidance. Compiled by Dr. P and outlined by B. Srinivas, IAS, the handbook aims to provide a user-friendly resource that employs simple language, practical examples, and visual aids to ensure its content is easily accessible to its primary audience, which includes farmers, Agri input dealers, Agripreneurs, Kisan Call Centers, and grassroots extension functionaries. It covers a wide range of topics, from baseline situation assessments to advanced farm management techniques, emphasizing the importance of adopting modern technologies, market opportunities, and Good Agricultural Practices (GAP) to improve farm income, food security, and environmental sustainability. Additionally, the handbook aims to professionalize engagement with various stakeholders in the agricultural sector and facilitate the implementation of advanced agricultural technologies and market strategies, ultimately contributing to the overall well-being and economic viability of the farming community."
2,"Question: What are the main objectives of the Partnership Farming India (PFI) project, and how does it aim to achieve these objectives?","Answer: The main objectives of the Partnership Farming India (PFI) project are to empower farmers and farm workers in Gujarat and Maharashtra by enhancing their management skills and adopting modern agricultural practices. The project aims to achieve these objectives by providing practical agricultural education to improve the international competitiveness of the farmers' produce, thereby transforming them into self-sufficient decision-makers and ""agripreneurs."" This initiative involves the creation of the Farmer's Handbook on Basic Agriculture, a comprehensive guide that educates farmers on scientific agriculture to improve productivity and competitiveness in the global market. The handbook is a collaborative effort involving experts from various agricultural disciplines and entities from both India and Germany, including Desai Fruits & Vegetables Pvt. Ltd. (DFV), the Deutsche Gesellschaft für Internationale Zusammenarbeit (GIZ) GmbH, and the National Institute of Agricultural Extension Management (MANAGE). Through this strategic approach, the PFI project seeks to upgrade production capabilities, establish a model for sustainable agriculture, and ensure the prosperity of farmers in the face of challenges such as low productivity and the need for value addition."
2,"Question: What are the key sustainable agriculture practices highlighted in the documentation, and how do they contribute to reducing agrochemical use?","Answer: The documentation highlights several key sustainable agriculture practices aimed at reducing agrochemical use, including Integrated Pest Management (IPM), precision farming, crop rotation, and the cultivation of pest-resistant plant varieties. IPM focuses on combining biological, cultural, physical, and chemical tools in a way that minimizes economic, health, and environmental risks. Precision farming involves using technology to apply inputs (like water, fertilizer, and pesticides) more efficiently, targeting specific areas or needs, thus reducing overall usage. Crop rotation and the cultivation of pest-resistant varieties naturally decrease pest populations and disease incidence, reducing the need for chemical pesticides. These practices contribute to sustainable agriculture by lowering production costs, minimizing environmental impact, and enhancing crop health and yield, ultimately leading to improved profitability and access to international markets for farmers."
2,Question: What are the key strategies employed to enhance agricultural productivity and farmer income in India according to the documentation?,"Answer: The documentation outlines several key strategies aimed at enhancing agricultural productivity and farmer income in India. These include the development and dissemination of technologies and knowledge through research and extension systems, which employ training and demonstrations to transfer technologies from laboratories to fields. It emphasizes the importance of location and crop-specific solutions and encourages farmers to acquire basic agricultural knowledge for better decision-making and adoption of modern technologies. The role of agriculture university extension systems, the Indian Council of Agriculture Research (ICAR), international institutions like the International Center for Research in Semi-Arid Tropics (ICRISAT), agribusiness companies, and agriclinics is highlighted in providing innovative extension strategies, technical knowledge dissemination, advisory services, and facilitating contract farming. Additionally, the documentation stresses the use of Information & Communication Technologies (ICT) for better access to extension services, information, and market knowledge. It also discusses the significance of diversifying livelihood sources, cooperative societies, Kisan Credit Card Scheme, agricultural insurance, and Krishi Vigyan Kendras (KVKs) in supporting farmers' financial needs and enhancing their knowledge and access to scientific support."
2,Question: How does the guide suggest farmers adapt to the challenges posed by climate change to ensure sustainable and profitable farming?,"Answer: The guide suggests that farmers adapt to the challenges posed by climate change through a multifaceted approach to ensure sustainable and profitable farming. It emphasizes the importance of integrating practical experience with scientific advancements and adopting appropriate farming systems and technologies tailored to specific locations. This includes understanding and adapting to changing climatic conditions through innovation and suitable technology adoption, such as selecting crops and cropping systems that are resilient to climate variability. The guide also highlights the significance of efficient utilization of natural resources, timely management practices, and the adoption of integrated farming systems (IFS) to manage natural resources effectively. Additionally, it underscores the need for farmers to evaluate the profitability and risks associated with various crops and cropping systems, considering economic viability and risk management strategies. The documentation also addresses the importance of understanding market demands, enhancing products through value addition, and establishing market linkages. Furthermore, it discusses the critical aspects of soil health, water availability, and the impact of climate factors like monsoon, temperature, rainfall, and seasons on agriculture, advocating for soil and water conservation measures. By addressing these areas, the guide aims to equip farmers with the knowledge and tools needed to navigate the challenges of climate change, ensuring their farming practices are both sustainable and profitable."
2,"Question: What are Integrated Nutrient Management (INM) strategies, and why are they considered essential for achieving sustainable crop production according to the documentation?","Answer: Integrated Nutrient Management (INM) strategies refer to a balanced approach that combines the use of organic and inorganic fertilizers to enhance soil fertility and ensure sustainable crop production. These strategies are essential for several reasons. Firstly, they help in maintaining soil health by improving its physical, chemical, and biological properties. This is achieved through the judicious use of chemical fertilizers in conjunction with organic amendments like farmyard manure, compost, and green manures, which help in building soil organic matter. Secondly, INM strategies aim to optimize the efficiency of nutrient use by crops, thereby reducing the dependency on chemical fertilizers, which can be costly and environmentally damaging if overused. By ensuring that nutrients are supplied in the right amounts, at the right time, and in an accessible form for plants, INM enhances crop productivity and income while minimizing negative impacts on the environment. Additionally, INM promotes the recycling of nutrients within the farm system, reducing waste and the need for external inputs. This holistic approach is crucial for achieving sustainable agricultural production, as it supports long-term soil fertility and health, leading to stable and increased crop yields over time."
2,Question: What are the key components of Integrated Pest Management (IPM) as outlined in the documentation?,"Answer: The key components of Integrated Pest Management (IPM) as outlined in the documentation include educating farmers on effectively and safely managing crop pests, diseases, and weeds. This approach emphasizes the importance of understanding the lifecycle of pests and their interaction with the environment to implement a combination of biological, cultural, physical, and chemical management strategies. The goal is to minimize the use of hazardous pesticides, thereby reducing the risks to human health and the environment. IPM also involves monitoring pest populations to make informed decisions about when and how to intervene, ensuring that pest management is both effective and sustainable."
2,"Question: How does accessing agricultural information from universities and magazines impact farmers' yields and net incomes, particularly in the cultivation of paddy, maize, and cotton?","Answer: Accessing agricultural information from universities and magazines significantly impacts farmers' yields and net incomes, especially in the cultivation of paddy, maize, and cotton. The documentation reveals that farmers who utilize this type of information tend to outperform those who do not, with notable improvements observed in the yield and net income from banana cultivation, which serves as an indicative example. This suggests that the trend is consistent across other crops as well, including paddy, maize, and cotton. The information provided by agricultural universities and magazines likely includes advanced farming techniques, pest management strategies, and crop-specific advice, which can lead to more efficient farming practices, higher yields, and increased profitability. The study underscores the willingness of farmers to invest in basic agricultural education as a means to enhance their productivity and income, indicating that the dissemination of agricultural knowledge plays a crucial role in improving agricultural outcomes."
2,Question: How does the Integrated Farming System (IFS) contribute to sustainability and efficiency in farming according to the documentation?,"Answer: The Integrated Farming System (IFS) contributes to sustainability and efficiency in farming by integrating multiple farming components such as animal husbandry, crop cultivation, and aquaculture, which are tailored to the specific needs and resources of the farmer. This holistic approach aims for sustainability by ensuring efficient use of resources and self-sufficiency, thereby reducing dependency on external inputs. It emphasizes the importance of planning, implementation, monitoring, and evaluation in the farming process to ensure food security, efficient resource allocation, and the recycling of resources within the farm. By adopting IFS, farmers can optimize the use of their land, labor, and other resources, leading to improved net income and farm profitability while also conserving the environment."
2,Question: What are the key strategies mentioned in the document for enhancing agricultural productivity and sustainability?,"Answer: The document outlines several key strategies for enhancing agricultural productivity and sustainability, focusing on soil and water conservation, crop cultivation techniques, and farm productivity enhancement. These strategies include the use of vegetative barriers, percolation tanks, contour trenching, raised bed planting, and shelterbelts for environmental moderation to improve agricultural output. Soil conservation techniques such as conservation tillage, minimum tillage, zero tillage, stubble mulching, and trash farming are emphasized to prevent soil erosion. The document also highlights the importance of strip cropping, mixed cropping, intercropping, and the use of vegetation on bunds for erosion control. Additionally, it discusses soil blowing control methods like deep ploughing and the use of windbreaks, alongside water erosion management techniques such as in situ water harvesting and various forms of bunding. Agricultural mechanization is underscored as a means to save resources, increase productivity, and reduce labor intensity. The document also elaborates on how vegetation can reduce runoff and enhance soil water storage, the impact of soil types on erosion, and the importance of conservation in maintaining soil and water resources. It further outlines irrigation and drainage considerations, including the suitability of land for irrigation, the timing and amount of irrigation, and the selection of appropriate irrigation methods like basin, furrow, and sprinkler irrigation, with a special note on the maintenance of irrigation systems to prevent erosion and ensure the effectiveness of basin irrigation."
2,Question: What are the key benefits of adopting good agricultural practices as outlined in the document?,"Answer: The document outlines several key benefits of adopting good agricultural practices, including reduced labor requirements, savings on equipment and fuel costs, and the importance of mulching for increased water retention, reduced erosion, and environmental protection. These practices contribute to improved soil quality, reduced drought susceptibility, and minimized dependency on external inputs, ultimately enhancing crop yield, conserving resources, and improving the efficiency of farming operations."
2,"Question: What are the different categories of seeds mentioned in the summary, and what is the significance of their tag colors?","Answer: The summary mentions four categories of seeds based on genetic purity and production process: nucleus, breeder, foundation, and certified seeds. Each category is identified by specific tag colors, which serve as a visual guide to their classification. Nucleus seeds represent the initial stage of seed production, containing the purest genetic material directly from plant breeding programs. Breeder seeds come from nucleus seeds and are used to produce foundation seeds. Foundation seeds are the next step in the seed production hierarchy, leading to the production of certified seeds, which are sold to farmers for planting. The tag colors help in ensuring the traceability and authenticity of seeds, facilitating quality control, and assuring farmers of the seed's genetic purity and health. This system of categorization and identification supports the overall goal of maintaining high standards in agricultural practices, ensuring that farmers have access to seeds of the highest quality for optimal yields."
2,Question: What are the key benefits of adopting a mechanized approach to weed management in agriculture as outlined in the documentation?,"Answer: The documentation outlines several key benefits of adopting a mechanized approach to weed management in agriculture. Firstly, it emphasizes the efficiency of mechanized weeding tools, such as the Cono Weeder and Tractor-Operated Cotton Weeder, in significantly reducing the labor and time required to manage weeds effectively. This mechanized approach allows for the timely and effective removal of weeds, which is crucial given that weeds can reduce crop yields by up to 50% if not managed within a critical period of the crop's growth. Secondly, mechanized weeding ensures uniformity and precision in weed removal, minimizing damage to crops and thereby enhancing yield quality and quantity. Thirdly, by reducing the reliance on chemical herbicides, mechanized weeding contributes to environmental sustainability, lowering the risk of chemical runoff and preserving soil health. Lastly, the adoption of mechanized weeding tools is presented as a scalable solution that can be adapted across various agricultural settings, offering a versatile and effective strategy to combat the tenacity of weeds and support the overall goal of increasing crop production efficiency and sustainability."
2,"Question: What are the common symptoms of nutrient deficiencies and diseases in plants as described in the documentation, and how do they vary across different crops?","Answer: The documentation outlines a variety of symptoms associated with nutrient deficiencies and diseases in plants, which vary significantly across different crops. For wheat, the deficiency symptoms start with white or yellow bands along the leaf tissue, progress to interveinal chlorotic mottling, and culminate in white to brown necrotic lesions, leading to leaf collapse. Rice plants exhibit initial symptoms of small, light yellow spots on older leaves, which then enlarge, merge, and turn deep brown, causing the entire leaf to dry out within a month. Citrus trees show irregular interveinal chlorosis, with terminal leaves becoming small and narrowed (little-leaf), reduced fruit-bud formation, twig dieback, and chlorosis between the veins of young leaves, including chlorotic and necrotic spots in the interveinal areas. Sugarcane displays symptoms of ""streak"" disease with greyish areas near the base of younger leaves turning yellowish to yellow-orange. Molybdenum (Mo) deficiency manifests as chlorotic interveinal mottling on lower leaves, followed by marginal necrosis and leaf infolding across various plants, and in cauliflower, it leads to ""whiptail,"" where leaf tissues wither, leaving only the midrib and a few small pieces of the leaf blade.

The document also describes a general decline in tree health, with early symptoms affecting a few limbs and eventually the entire tree, leading to sparse mottled leaves, stunted growth, and a sickly appearance. The midrib and lateral veins of old, mature leaves turn yellow, leaves may be shed prematurely, accompanied by twig die-back, and the tree may bear short twigs with narrow small leaves. Secondary growth consists of short, weak shoots with discolored leaves, excessive flowering, but fruits do not mature and show distinct sun-blotching.

Furthermore, the documentation details the deficiency symptoms of various nutrients in plants, such as nitrogen, phosphorous, potassium, calcium, magnesium, zinc, copper, iron, boron, manganese, and sulfur, which present unique symptoms ranging from stunted growth, chlorosis, necrosis, delayed flowering, and poor seed or fruit development, to more specific signs like yellow striping, reddish-purple veins, and cup-shaped or crinkled leaves. It emphasizes the importance of consulting local extension workers for remedies upon observing these symptoms and highlights the significance of nutrient management in soil and plant nutrition. Additionally, it discusses Verticillium wilt, affecting seedlings and mature plants, and suggests planting resistant varieties as a management strategy."
2,Question: What are the key factors in optimizing soil health and fertilizer use for various crops according to the documentation?,"Answer: The documentation highlights the critical importance of soil testing as the foundational step in optimizing soil health and fertilizer use for various crops, including bananas, cotton, citrus (notably Nagpur Mandarin), mango, sugarcane, and sunflower. By conducting soil tests, farmers can determine the precise fertilizer requirements for each crop, allowing for the accurate application of nitrogen, phosphorus, and potassium. For bananas, a significant application of potassium is suggested, with additional fertilization recommendations for tissue culture variants. The document emphasizes that understanding the specific nutrient needs of each crop, based on soil health, is essential for achieving optimal growth, yield, and quality. This approach not only enhances crop productivity but also contributes to sustainable agricultural practices by preventing over-fertilization and minimizing environmental impact."
2,"Question: What are the benefits of using mycorrhizae in plant cultivation, and how do they contribute to plant health according to the documentation?","Answer: The documentation highlights the significant benefits of using mycorrhizae, specifically endomycorrhizal and ectomycorrhizal fungi, in plant cultivation. Mycorrhizae form symbiotic relationships with plants, where they enhance plant vitality and disease resistance in several ways. Firstly, they improve nutrient uptake, particularly phosphorus, by extending the root system's reach into the soil, which directly contributes to better plant growth and health. Secondly, mycorrhizae help in water absorption, making plants more resilient during drought conditions. Additionally, these fungi play a crucial role in disease resistance by forming a physical barrier around roots, which can prevent the invasion of pathogenic microbes. The documentation also suggests that mycorrhizal associations can stimulate the plant's own immune responses, further enhancing its ability to ward off diseases. Overall, the incorporation of mycorrhizal fungi into plant cultivation practices is presented as a critical strategy for promoting healthier and more robust plants."
