Level,Question,Answer
1,"Question: What are the key differences between soil testing and plant analysis as outlined in the documentation, and why are both methods considered crucial for nutrient management in agriculture?","Answer: The documentation outlines two main differences between soil testing and plant analysis. Soil testing is described as a method for identifying the nutrients available in the soil, which serves as the basis for determining what fertilizers need to be added to replenish nutrients depleted after harvests. This process is crucial for ensuring that the soil has the necessary nutrients to support plant growth. On the other hand, plant analysis is presented as a complementary tool that assesses how effectively plants are utilizing the available nutrients. This method involves analyzing the actual nutrient status within the plant or crop, which can differ significantly from the nutrient availability in the soil. Plant analysis requires sampling the correct plant part and growth stage for accurate results, as nutrient concentration varies among different plant parts.

Both methods are considered crucial for nutrient management in agriculture for several reasons. Soil testing provides a foundation for creating effective nutrient management plans by identifying the baseline nutrient levels in the soil. This information is essential for determining the appropriate types and amounts of fertilizers needed to replenish the soil and support crop growth. Plant analysis, in turn, offers insights into the efficiency of nutrient uptake and utilization by the plants, allowing for adjustments in nutrient management practices to improve crop yield and quality. Together, these methods enable a more precise and balanced approach to fertilization, which is key to achieving higher crop yields, maintaining soil fertility, and minimizing nutrient loss."
1,Question: What are the recommended practices for nutrient assessment and fertilizer application in cotton as outlined in the documentation?,"Answer: The documentation recommends a comprehensive approach to nutrient assessment and fertilizer application in cotton, emphasizing the importance of understanding the changing nutrient concentration in plants as they mature. For nutrient assessment, it specifies sampling the entire above-ground portion of the plant at the seedling stage and the youngest fully mature leaves at the first bloom and when first squares appear. This careful assessment helps in determining the nutrient status accurately.

For fertilizer application, the document advocates for a nutrient-focused approach rather than a generic one. It suggests selecting fertilizers based on the desired production responses, cost-effectiveness, and their suitability for the crop and soil. The guidelines recommend choosing crops and varieties known for the best fertilizer response in the locality, planning fertilization according to the cropping pattern rather than for single crops, and consulting soil analysis reports before deciding on fertilization application rates. It also emphasizes the importance of balanced fertilization, optimal planting times, appropriate plant population and spacing, and effective pest and disease control for maximizing fertilizer efficiency and yield.

The document describes various fertilizer application methods, including broadcasting, placement (band and spot application), ring application around trees, foliar application of liquid fertilizers, and fertigation (applying fertilizer along with irrigation). It notes the efficiency, labor intensity, and cost implications of each method, highlighting the high efficiency but also the high cost and special equipment requirements of foliar application and fertigation.

Specific recommendations for nitrogen application include splitting applications and using slow-release modes to minimize loss. It suggests frequent small quantity applications through foliar methods for quick crop recovery and, for plantation and long-duration crops, recommends slow-release nitrogen and coated urea-neem oil under puddle conditions.

Additionally, the document provides a fertigation schedule for applying water-soluble fertilizers, recommending 7 to 8 splits at 15 to 20-day intervals for nitrogen, phosphorus, and potassium, to ensure efficient nutrient use and optimal crop growth."
1,"Question: What are the recommended practices for managing nitrogen deficiency in citrus orchards, according to the documentation?","Answer: The documentation recommends addressing nitrogen deficiency in citrus orchards by applying nitrogenous fertilizers, as citrus trees are described as nitrogen-loving plants. It suggests that nitrogen-containing fertilizers should be applied in three equal splits to manage the deficiency effectively. Additionally, the use of farmyard manure, compost, or oil cakes is encouraged to provide a portion of the nitrogen dose. This approach not only addresses the immediate nitrogen deficiency but also contributes to the long-term health and productivity of the citrus trees by ensuring a steady supply of nitrogen, which is crucial for their growth and fruit development."
1,"Question: What are the recommended fertilizer amounts for bananas according to the documentation, and how does it differ for tissue culture bananas?","Answer: According to the documentation, bananas require 110 kg of nitrogen (N), 35 kg of phosphorus (P2O5), and 330 kg of potassium (K2O) per hectare. For tissue culture bananas, an additional 50% fertilizer application is recommended at specific intervals. This differentiation highlights the tailored approach to fertilization based on the cultivation method, acknowledging the unique nutritional needs of tissue culture bananas compared to traditionally grown bananas."
1,Question: What are the main advantages and disadvantages of chemical and organic fertilizers as outlined in the document?,"Answer: The document outlines several advantages and disadvantages of both chemical and organic fertilizers. Chemical fertilizers are praised for their immediate nutrient availability, cost-effectiveness, and efficiency in small quantities, making them a popular choice for quick nutrient supplementation. However, they come with significant downsides, including the potential for economic and environmental losses due to over-application, increased vulnerability of plant tissues to diseases, soil degradation, and nutrient loss through chemical reactions.

On the other hand, organic fertilizers offer a range of benefits that contribute to long-term soil health and fertility. These include a balanced nutrient supply, enhanced soil biological activity, improved soil structure, increased organic matter content, and a slow release of nutrients. Despite these benefits, organic fertilizers also have their drawbacks, such as low nutrient content, effectiveness only over the long term, potential inability to supply all necessary plant nutrients, higher costs, and bulkiness.

The document emphasizes that while both types of fertilizers have their place in agriculture, efficient use and good management practices are crucial to maximizing their benefits and minimizing their drawbacks. It advocates for Integrated Nutrient Management as a sustainable approach that combines the advantages of both chemical and organic fertilizers."
1,"Question: What are the benefits of using organic fertilizers and bio-fertilizers in agriculture, and how do they compare to chemical fertilizers in terms of nutrient supply?","Answer: Organic fertilizers, derived from natural sources such as cow dung, farmyard manure, and compost, offer several benefits in agriculture, including the improvement of soil structure, enhancement of soil fertility, and provision of essential nutrients to crops. These fertilizers release nutrients slowly, matching more closely with the natural nutrient uptake patterns of plants. However, to achieve the same nutrient levels as chemical fertilizers, a significantly larger quantity of organic manure is required. For example, 1000-2000 kg of organic manure is needed to match the nutrients provided by a 50 kg bag of NPK fertilizer.

Bio-fertilizers, on the other hand, are microbial products containing live cells of microorganisms that supply nutrients to plants either by fixing atmospheric nitrogen or by solubilizing soil phosphorus. Nitrogen-fixing bio-fertilizers can supply between 10 kg to 100 kg of nitrogen per hectare, while phosphorus-solubilizing or -absorbing bio-fertilizers can mobilize 10 kg to 50 kg of phosphorus per hectare. This makes bio-fertilizers particularly efficient in enhancing soil fertility and promoting sustainable agriculture by reducing dependency on chemical fertilizers.

In comparison to chemical fertilizers, which provide quick nutrient release in large quantities, organic and bio-fertilizers offer a more sustainable approach by improving soil health and fertility over the long term, reducing environmental impact, and supporting the ecological balance. However, the use of chemical fertilizers may still be necessary in smaller quantities for immediate nutrient needs or specific crop requirements."
1,"Question: What are the recommended practices for composting as outlined in the document, and how do they contribute to the effectiveness of Farm Yard Manure (FYM)?","Answer: The document recommends several best practices for composting to enhance the effectiveness of Farm Yard Manure (FYM). Firstly, it advises selecting a shaded, well-drained, and elevated site for the composting process, which is close to cattle sheds and water sources. This location choice helps in maintaining the necessary moisture levels and makes it convenient to add cattle waste to the compost. Secondly, it suggests creating smaller, manageable heaps that are kept weed-free, which allows for better aeration and easier turning of the compost, leading to more efficient decomposition. The inclusion of cattle urine and ash, spread uniformly across the compost rather than heaped, is also recommended to enrich the compost with additional nutrients. These practices collectively ensure that the composting process is optimized, resulting in high-quality FYM that is rich in nutrients, which can significantly improve soil health and fertility when applied to fields."
1,Question: What are the recommended practices for managing Fusarium wilt and leaf spot diseases in cotton as outlined in the documentation?,"Answer: The documentation recommends several practices for managing Fusarium wilt and leaf spot diseases in cotton. These include the use of fungicide seed treatments to protect the seeds from disease before and during germination, implementing crop rotation to prevent the buildup of disease-causing pathogens in the soil, and the selection and use of resistant varieties of cotton that are less susceptible to these diseases. These measures are aimed at reducing the incidence of Fusarium wilt and leaf spot diseases, thereby helping to maintain healthy cotton crops and improve yield."
1,Question: What are the key factors contributing to the profitability of banana cultivation as outlined in the documentation?,"Answer: The profitability of banana cultivation, as outlined in the documentation, is attributed to several key factors. Firstly, the document highlights the importance of specific cultivation practices, including the selection of high-yield varieties and efficient post-harvest handling and packaging methods, which are crucial for extending the shelf life of bananas and meeting export quality standards. The economic analysis provided shows a cost-benefit ratio of 1:1.67, indicating that for every unit of cost incurred, there is a 1.67 unit return on investment, underscoring the profitability of banana cultivation. Additionally, the documentation mentions the significant production volume of bananas in India, with a production of 26.217 million metric tons from 0.709 million hectares, and identifies Tamil Nadu, Maharashtra, and Gujarat as major banana-producing states with high productivity rates. The use of bananas in various food products, both in unripe and ripened forms, also contributes to their market demand, further enhancing their economic viability. These factors combined—efficient cultivation and post-harvest practices, high production volume, and versatile market demand—contribute significantly to the profitability of banana cultivation as detailed in the documentation."
1,"Question: What are the ideal climate conditions for banana cultivation, and how should the soil be prepared to optimize growth?","Answer: The ideal climate conditions for banana cultivation include a warm, humid environment with average temperatures around 27°C and annual rainfall ranging from 2,000 to 2,500 mm. These conditions necessitate assured irrigation facilities to maintain the required moisture levels. For soil preparation, the ideal soil type is loamy and salty clay loam with high fertility, as extreme clayey and sandy soils are unsuitable for banana growth. The preparation process involves thorough ploughing, harrowing, and planking to level the field. This is followed by digging pits of 30 x 30 x 30 cm at a spacing of 1.5 x 1.5 m for planting. To combat soil-borne pests and diseases, soil sterilization is recommended, either through exposure to sunlight for 10 to 15 days or soil solarization using transparent plastic for 15 to 20 days during summer. This meticulous preparation of soil and adherence to specific climate requirements are crucial for the successful cultivation of bananas."
1,Question: What are the recommended methods for controlling the Bunchy top Aphid and preventing premature fruit ripening in bananas according to the Farmer's Handbook on Basic Agriculture?,"Answer: To control the Bunchy top Aphid in bananas, the Farmer's Handbook on Basic Agriculture recommends the use of a systemic insecticide named Acetamiprid at a concentration of 0.2gm per litre. For preventing premature fruit ripening, the handbook suggests dipping the sucker in a solution of Aurofugin1, mixed at a ratio of 10g per 100 litres of water, for 1.5 hours. These specific remedies are part of a broader set of measures aimed at ensuring the health and productivity of banana plants by addressing both pest control and disease management effectively."
1,"Question: What are the recommended dimensions for preparing pits for planting, and why is soil sterilization important in the cultivation of Nagpur Mandarin and other crops?","Answer: The recommended dimensions for preparing pits for planting are 1 meter in length, 1 meter in width, and 1 meter in depth. These pits are left exposed for 2 to 4 weeks to eliminate harmful soil organisms, a process that is crucial for creating a healthy environment for the plants to grow. Soil sterilization is emphasized as an essential step in the cultivation of Nagpur Mandarin and other crops because it helps in eradicating soil-borne pathogens, pests, and weeds that could potentially harm the plants. This can be achieved through physical methods like steam and solar energy, or chemical methods using herbicides and fumigants. Additionally, soil solarization, which involves using transparent plastic mulch film of 25 micron thickness, is recommended as an effective way to sterilize the soil by trapping solar heat. This process not only helps in controlling pests and diseases but also improves soil structure and nutrient availability, leading to healthier and more productive plants."
1,Question: What are the recommended practices for managing alternate bearing in mango trees to ensure regular fruit bearing?,"Answer: For managing alternate bearing in mango trees, the recommended practice is the use of paclobutrazol, with a dosage of 5-10 grams per meter of canopy diameter, applied through soil drenching three months before budburst. This treatment helps in ensuring regular fruit bearing by controlling the vegetative growth and promoting more uniform flowering and fruiting cycles."
1,Question: What are the recommended methods for controlling Mealy bug Nymphs in citrus orchards according to the document?,"Answer: The document recommends controlling Mealy bug Nymphs in citrus orchards by raking the soil around the tree trunk and mixing it with neem cake to prevent the pests from harming young shoots, panicles, and flower pedicels by sucking their juice."
1,"Question: What are the recommended concentrations of acetamiprid or thiamethoxam for controlling fruit fly infestations, and how do these infestations affect the fruits?","Answer: The recommended concentrations of acetamiprid or thiamethoxam for controlling fruit fly infestations are 0.2gm per liter of water. Fruit fly infestations cause significant damage to fruits by laying eggs under the peel just before the fruits ripen. This leads to the fruits rotting, as the larvae hatch and feed inside the fruit, making them unsuitable for consumption and sale. The application of these chemicals at the specified concentrations helps in effectively managing the fruit fly populations, thereby protecting the fruits from damage and loss."
1,Question: What are the recommended practices for managing fruit drop in Nagpur mandarin orchards as outlined in the document?,"Answer: The document recommends addressing the issue of fruit drop in Nagpur mandarin orchards by understanding its economic impact and recognizing the critical growth stages at which fruit drop occurs. While specific practices to manage fruit drop are not detailed in the summary, the emphasis on disease control, proper irrigation, and avoiding stress on the trees through careful cultivation practices suggests a holistic approach to managing the health of the orchard. This includes the elimination of Phytophthora-infected plants, which could indirectly reduce stress on the trees and potentially minimize fruit drop. Additionally, the document's focus on avoiding water stagnation and the use of disease-free seeds implies that maintaining overall tree health through preventive measures is key to managing fruit drop in Nagpur mandarin orchards."
1,Question: What are the recommended treatments for managing fruit drop and disease in Nagpur Mandarin and other susceptible fruits according to the documentation?,"Answer: The documentation recommends several treatments for managing fruit drop and disease in Nagpur Mandarin and other susceptible fruits. To mitigate fruit drop post-fruit set and pre-harvest, it advises two foliar sprays of 2,4-D or GA3 at 15 parts per million (ppm) combined with 1% urea and 0.3% copper oxychloride, applied monthly during April-May and again in September-October. For pre-harvest disease management, three sprays of difenoconazole at 2ml per liter of water, spaced 15 days apart until drenching, are suggested to reduce pre-harvest fruit drop by 54% and control post-harvest diseases by up to 70%. Post-harvest, dipping fruits in a difenoconazole solution for five minutes significantly reduces rotting and allows for safe storage for up to three weeks under normal conditions. To prevent fungicide resistance, it is recommended to alternate fungicides such as difenoconazole, azoxystrobin, and copper oxychloride at specified concentrations, starting from November and applied monthly. Additionally, for specific diseases like Anthracnose, spraying copper oxychloride 0.25% or Bordeaux mixture 1% and post-harvest dipping in difenoconazole are advised. For Bunchy-top disease, the importance of using disease-free planting material is emphasized due to its transmission through infected suckers."
1,"Question: What is Integrated Pest Management (IPM), and why is it emphasized in the documentation provided to farmers?","Answer: Integrated Pest Management (IPM) is defined as a sustainable approach to managing pests by combining biological, cultural, physical, and chemical tools in a way that minimizes economic, health, and environmental risks. The documentation emphasizes IPM to enhance farmers' understanding and skills in managing crop pests, including insects, diseases, and weeds, in a manner that is both effective and environmentally responsible. By educating farmers on IPM, the aim is to equip them with the knowledge to implement pest control methods that reduce the reliance on chemical pesticides, thereby minimizing potential negative impacts on health and the environment. This approach not only helps in safeguarding the ecosystem but also ensures the long-term sustainability of agricultural practices by promoting the safe handling of chemicals and the use of alternative pest management strategies."
1,"Question: What are the main differences between complete and incomplete metamorphosis in insects, and how do these life cycle stages impact agricultural crops?","Answer: The main differences between complete and incomplete metamorphosis in insects lie in the number of life cycle stages and the characteristics of each stage. Complete metamorphosis involves four distinct stages: egg, larva, pupa, and adult. During the larval stage, insects undergo rapid growth and consume large amounts of food, which can be particularly damaging to crops. Examples of insects undergoing complete metamorphosis include butterflies, silkworms, mealworms, and ladybugs. The pupa stage is a period of transformation inside a protective case, leading to the emergence of the adult form.

Incomplete metamorphosis, in contrast, consists of three stages: egg, nymph, and adult. The nymph stage closely resembles the adult but is smaller and lacks wings. Insects such as grasshoppers, cockroaches, ants, and praying mantids undergo incomplete metamorphosis. The nymph stage can also cause damage to crops as these insects feed and grow, although the nature of the damage may vary compared to the larval stage of insects with complete metamorphosis.

Both types of metamorphosis impact agricultural crops through the consumption and destruction of plant tissues. Larvae from insects with complete metamorphosis and nymphs from those with incomplete metamorphosis can consume leaves, fruits, and other plant parts, leading to significant crop damage. Additionally, adult insects, particularly those with complete metamorphosis, can also cause damage, though many are harmless and some are even beneficial to agriculture. The extent of the damage depends on the insect species and the stage of its life cycle, highlighting the importance of understanding these life cycle stages for effective pest management in agriculture."
1,Question: What are the roles of honey bees and silk worms in agriculture as highlighted in the document?,"Answer: The document highlights honey bees' crucial role in agriculture, primarily through pollination and honey production. Pollination by honey bees is essential for the growth of many crops, ensuring the production of fruits, vegetables, and nuts. Honey bees contribute significantly to enhancing agricultural productivity and biodiversity. Silk worms, on the other hand, are beneficial insects known for producing silk, a valuable material in the textile industry. While their direct impact on crop production may be less apparent than that of honey bees, silk worms represent an important aspect of agricultural biodiversity and economic value through silk production. Both insects exemplify the positive contributions of certain insect species to agriculture and human economies."
1,Question: What are the key strategies recommended for sustainable pest management in agriculture according to the documentation?,"Answer: The documentation recommends several key strategies for sustainable pest management in agriculture, emphasizing the importance of a strategic and informed approach. These strategies include understanding the life cycle of insects and utilizing natural predators for natural pest control, employing mechanical control methods such as removing affected plant parts and using barriers to protect crops, and adopting agronomical practices like summer ploughing, using trap crops, mixed cropping, and crop rotation to maintain field cleanliness and manage pests effectively. Additionally, it advises farmers to accurately identify beneficial and harmful insects, understand the economic threshold level of major pests to determine the necessity and extent of control measures, and consider biological control methods as part of an integrated pest management approach. The documentation also suggests harvesting fruits and vegetables after a waiting period to minimize the residual effects of pest control measures, highlighting the importance of careful planning and execution in achieving sustainable pest management in agriculture."
1,Question: What is the Economic Threshold Level (ETL) and how does it guide pest control measures in agriculture?,"Answer: The Economic Threshold Level (ETL) is a critical concept in agricultural pest management, defined as the pest population density at which control measures should be initiated to prevent the pests from causing economic damage, known as the economic injury level. It acts as a guideline for farmers to determine when it is cost-effective to apply control measures against pests. For instance, specific ETLs are provided for various crops, such as 5-10 nymphs or adult hoppers per hill for brown plant hopper in paddy, indicating the point at which interventions are necessary to prevent significant economic loss. The document also emphasizes the importance of managing pests below the ETL using biological control methods, such as the use of parasites that target pests at different developmental stages, to maintain pest populations at manageable levels without resorting to chemical controls. This approach not only helps in effective pest management but also in reducing the reliance on agrochemicals, thereby promoting safer and more sustainable agricultural practices."
