Level,Question,Answer
1,Question: What are the key factors to consider when making irrigation decisions in agricultural practices?,"Answer: When making irrigation decisions in agricultural practices, several key factors must be considered to ensure effective water management and crop growth. These factors include:

1. **Assessing Land Suitability:** This involves evaluating the land based on factors such as slope. A mild gradient up to 1% is desirable to prevent soil and water erosion, while higher gradients may not be suitable for sustainable agricultural practices.

2. **Rainfall Contribution:** Understanding the portion of rainfall that effectively contributes to crop production is crucial. This involves considering the amount of rainfall that is available for crop use after accounting for losses due to evaporation, runoff, and infiltration.

3. **Determining Irrigation Timing:** The timing of irrigation should be based on soil, crop, and climatic conditions. This ensures that water is supplied when it is most needed by the crops, optimizing water use efficiency and crop yield.

4. **Calculating Crop Water Requirement:** This calculation helps decide the amount of irrigation needed. It takes into account the water needs of a specific crop type and the stage of crop growth, ensuring that crops receive adequate water for optimal growth.

5. **Choosing the Appropriate Irrigation Method:** Various irrigation methods are available, including surface irrigation (basin and furrow irrigation), sprinkler irrigation, and drip irrigation. The choice of method depends on factors such as water availability, crop type, soil characteristics, and economic considerations.

6. **Considering the Quality of Irrigation Water:** The quality of water used for irrigation is important, as poor-quality water can lead to soil salinity or toxicity problems, affecting crop growth and soil health.

By carefully considering these factors, farmers and agricultural managers can make informed decisions about irrigation practices, leading to more efficient water use, better crop yields, and sustainable agricultural development."
1,Question: What are the main factors that influence the size and shape of irrigation basins in basin irrigation systems?,"Answer: The size and shape of irrigation basins in basin irrigation systems are influenced by several key factors. These include the slope of the land, the type of soil, the size of the stream used for irrigation, the required depth of irrigation, and the specific farming practices being employed. For example, steep slopes or sandy soils, which allow water to percolate quickly, necessitate the construction of smaller basins to ensure efficient water use and to prevent water wastage. Conversely, flat or gently sloping lands with clay soils, which retain water better, can accommodate larger basins. Additionally, the method of field preparation plays a significant role; basins prepared with mechanized equipment can be made larger than those prepared manually or with animal power. The width of a basin is also affected by the depth of fertile soil, the method of construction, and the agricultural practices in place, further demonstrating the adaptability of basin irrigation to various environmental and agricultural conditions."
1,Question: What are the key considerations for implementing furrow irrigation effectively in agricultural practices?,"Answer: Implementing furrow irrigation effectively requires careful attention to several key considerations. Firstly, the alignment of furrows with the slope of the land is crucial to ensure even water distribution and prevent erosion. The soil type is another important factor, as it affects the infiltration rate of water; furrow irrigation is most effective in soils with infiltration rates between 0.5 and 2.5 cm/hr. The size of the water stream, which should ideally be between 1-2 liters/sec, and the depth of irrigation need to be adjusted according to the crop's water requirement and the soil's water-holding capacity. Cultivation practices and field length also play significant roles in determining the efficiency of furrow irrigation. The method is best suited for fields with uniform flat or gentle slopes, typically ranging from 0.2 to 0.5 percent, to facilitate optimal water flow and distribution. Additionally, furrow irrigation is particularly beneficial in areas that require surface drainage or are prone to temporary waterlogging. In regions where water is scarce, alternate or skip furrow irrigation techniques can be employed to conserve water without significantly impacting crop yields. This method is highly recommended for a variety of crops, including row crops and vegetables, due to its adaptability and efficiency in water use."
1,"Question: What are the main components of a drip irrigation system as outlined in the document, and how does it contribute to water savings and increased crop yield?","Answer: The main components of a drip irrigation system, as outlined in the document, include a pump unit, control unit, filtering unit, main and sub-mainlines, laterals, and emitters. This system contributes to water savings and increased crop yield through its efficient water delivery mechanism. By delivering water directly to the root zone of plants, it minimizes evaporation and runoff, ensuring that water is used optimally. This targeted irrigation method is particularly beneficial at critical growth stages of various crops, leading to significant increases in crop yield. For example, mango and sugarcane have shown yield increases of 80% and 133.3% respectively, with substantial water savings compared to traditional surface irrigation methods. The efficiency of drip irrigation in terms of water use is highlighted as superior, making it a crucial component in efforts to promote water conservation and enhance agricultural productivity."
1,Question: What is the role of the National Committee on Plasticulture Application in Horticulture (NCPAH) in the scheme aimed at promoting plasticulture applications in horticulture?,"Answer: The National Committee on Plasticulture Application in Horticulture (NCPAH) plays a pivotal role in the scheme aimed at promoting plasticulture applications in horticulture by coordinating its activities at the national level. The NCPAH, along with its Executive Committee, is responsible for approving the Action Plan that outlines the structure and operational framework of the scheme. This committee ensures that the scheme's objectives are met by overseeing its implementation across the designated areas of operation, which include horticultural crops covered under the National Horticulture Mission across 24 States and Union Territories. The NCPAH's leadership and guidance are crucial for the successful promotion of plasticulture applications, thereby enhancing the efficiency and productivity of horticulture in the targeted regions."
1,Question: What are the primary functions of seeds and how are quality seeds characterized in terms of genetic and physical purity?,"Answer: The primary functions of seeds include nourishing the embryo, enabling dispersal to new locations, and maintaining dormancy under unfavorable conditions to ensure the survival and propagation of plant species. Quality seeds are characterized by their genetic purity, with specific standards set for different types of seeds such as breeder/nucleus seeds (100% purity), foundation seeds (99.5% purity), and certified seeds (99% purity). In addition to genetic purity, quality seeds must also meet physical purity requirements, which vary by crop but generally require at least 98% purity. For example, carrots require 95% purity, while other specific crops like bhendi, sesame, soybean, jute, and groundnut have their own designated purity percentages. Quality seeds should be free from seeds of other crops, designated diseases (e.g., loose smut in wheat), and objectionable weed seeds (e.g., wild paddy in paddy). They must also meet variety-specific standards for shape, size, color, physical soundness, weight, physiological vigor, longevity, shelf life, and moisture content, with moisture levels specified for long-term (8% and below) and short-term (10-13%) storage to ensure optimal growth and yield when planted."
1,"Question: What are the main methods of seed treatment mentioned in the documentation, and how do they differ from each other?","Answer: The documentation mentions three primary methods of seed treatment: seed dressing, seed coating, and seed pelleting. Seed dressing is the most common method and involves applying a dry or wet formulation to the seeds. This can be done on farms or in industries using simple materials like earthen pots or polythene sheets for mixing seeds with pesticides. Seed coating goes a step further by using a special binder with the formulation to enhance the adherence of the treatment to the seed, ensuring a more uniform and effective application. Seed pelleting, the most sophisticated and expensive method, changes the physical shape of the seed to improve its pelletability and handling. This method requires specialized machinery and is used to ensure precise planting and better protection of the seeds. Each method offers different benefits, from the simplicity and low cost of seed dressing to the advanced protection and handling improvements of seed pelleting."
1,"Question: What are the recommended bioagents for seed treatment in the document, and how do they contribute to combating crop diseases and pests?","Answer: The document recommends using bioagents such as Trichoderma spp., Pseudomonas fluorescens, and Paecilomyces lilacinus for seed treatment across various crops including sugarcane, rice, chillies, bhendi (okra), tomato, and sunflower. These bioagents play a crucial role in combating crop diseases and pests by acting as biological control agents. Trichoderma spp. are known for their ability to suppress soil-borne pathogens through competition, parasitism, and the production of antimicrobial compounds. Pseudomonas fluorescens helps in controlling fungal diseases by producing a wide array of antibiotics and can also induce systemic resistance in plants, enhancing their defense mechanisms against pathogens. Paecilomyces lilacinus is particularly effective against nematodes, parasitizing their eggs and thus reducing their population and damage to the crops. By incorporating these bioagents into seed treatment protocols, the guidelines aim to improve overall crop health, reduce reliance on chemical pesticides, and promote sustainable agricultural practices."
1,"Question: What are the main objectives of implementing an Integrated Farming System (IFS), and how does it aim to achieve these objectives?","Answer: The main objectives of implementing an Integrated Farming System (IFS) include effectively utilizing by-products, providing employment for family members, maximizing land use, adding value to products, achieving self-sustainability, and reducing dependence on external resources. IFS aims to achieve these objectives by integrating various components such as animal husbandry, crop cultivation, aquaculture, and agro-based production and processing units into a comprehensive, diversified farming system. This system is designed to be highly efficient in resource use, sustainable, and tailored to the specific location, resources, and needs of the farmer. Key strategies include the integration of multiple enterprises, planning based on available resources, ensuring food security, meeting livestock fodder requirements, focusing on enterprise-based crops, and planning for resource recycling and efficient resource allocation. Additionally, IFS emphasizes the importance of planning, implementation, monitoring, and evaluation to optimize farm management, reduce losses, increase profits, and replicate successes in future endeavors."
1,"Question: What is the critical period of weed competition for crops like sorghum, maize, and tomato, and why is it significant for farmers to manage weeds effectively during this time?","Answer: The critical period of weed competition for crops such as sorghum, maize, and tomato is approximately 30 days after sowing. This period is significant for farmers because it is during this time that weeds and crops compete most intensely for essential resources like water, soil nutrients, light, and space. Effective weed management within this critical window is crucial because it can significantly reduce the negative impact of weeds on crop yields. If weeds are not managed properly during this period, they can outcompete the crops for these vital resources, potentially reducing crop yields by up to 50%. Therefore, timely and effective weeding during this critical period helps ensure that crops have the necessary resources to grow optimally, leading to higher productivity and sustainability in agriculture."
1,Question: What are the key strategies for sustainable agriculture outlined in the documentation to minimize the use of agrochemicals?,"Answer: The documentation outlines several key strategies for sustainable agriculture aimed at minimizing the use of agrochemicals. These include:

1. **Crop Rotation Systems**: This involves sequencing crops in a way that disrupts the life cycle of pests. By rotating crops that are not hosts to the pests of the previous crops, the strategy aims to combat specific weeds and pests without the use of chemicals.

2. **Cultivation of Pest-Resistant Plant Varieties**: The documentation emphasizes the development and use of transgenic crops that are designed to resist specific pests. This approach helps in reducing the pesticide load on the environment and lowers production costs.

3. **Promotion of Useful Animals**: Encouraging the growth of beneficial insects and maintaining a healthy predator population are recommended. Strategies include creating environments conducive to these predators, such as installing bird perches and studying the habitats of useful animals.

4. **Observation and Control of Pest Populations**: This involves following both short-term and long-term pest forecasts, studying pest habitats and weather conditions favorable to pests, and taking necessary precautions for pest management.

5. **Prioritization of Mechanical and Biological Measures Over Chemical Ones**: The documentation advocates for a thorough understanding of botanical pesticides and the ecosystem of parasites, predators, and friendly insects. Developing an action plan for mechanical and biological measures is encouraged.

6. **Crop Management Strategies**: The use of trap crops, mixed cropping, and intercropping are suggested to protect the main crops from pests and to increase the population of natural enemies. These strategies also contribute to the diversification of the agroecosystem, enhancing its resilience.

Overall, the documentation presents a comprehensive approach to sustainable agriculture that emphasizes environmental sustainability, pest resistance strategies, and the promotion of biodiversity through natural pest control methods."
1,Question: How do the physical and biological components of soil contribute to its fertility and overall health?,"Answer: The physical and biological components of soil play crucial roles in determining its fertility and overall health. Physically, soil is composed of minerals, water, air, and organic matter, with its texture being a key factor. The texture, determined by the relative proportions of sand, silt, and clay, influences the soil's drainage, water holding capacity, aeration, and nutrient availability. For example, sandy soils, while having good aeration, tend to have low fertility and water retention, whereas clayey soils are highly fertile but suffer from poor aeration and drainage. Loamy soils, with a balanced mix of sand, silt, and clay, offer medium fertility and good aeration, making them ideal for a wide range of plant growth.

Biologically, soil is teeming with life, including bacteria, earthworms, and other organisms that contribute to the soil's health and fertility. These living components are essential for the decomposition of organic matter, which in turn enriches the soil with nutrients necessary for plant growth. Organic matter not only supplies nutrients but also improves soil texture, enhances water retention, and supports aeration, thereby creating a more favorable environment for root development and plant growth.

Furthermore, the color of soil, often indicative of its organic matter content, can signal its fertility level. Dark soils, rich in organic matter, are typically more fertile and better at retaining water and nutrients, which are essential for plant health. In contrast, light-colored soils may indicate lower fertility and potential issues with nutrient leaching.

In summary, the interplay between the physical structure of soil and its biological activity is fundamental to soil fertility and health. The balance of minerals, organic matter, water, and air, combined with the activity of soil organisms, creates a dynamic environment that supports the growth of plants by providing essential nutrients, water, and a suitable structure for root development."
1,Question: How does soil pH influence plant growth and nutrient availability according to the document?,"Answer: According to the document, soil pH plays a critical role in plant growth by affecting nutrient availability, potential toxicities, and the activity of soil organisms. A soil's pH level can determine how easily plants can absorb nutrients. For instance, in highly acidic or highly alkaline soils, certain nutrients may become less available to plants, leading to deficiencies and affecting plant health. Conversely, some toxic elements may become more soluble and harmful at certain pH levels. To manage soil pH effectively, the document suggests using lime to raise the pH of acid soils, while gypsum or sulfur can be used to lower the pH of alkali soils. The quantity of these amendments should be based on soil test reports to ensure the correct adjustment of soil pH, thereby optimizing nutrient availability and minimizing toxicities for improved plant growth."
1,"Question: What are the key practices recommended for improving soil organic matter, and why is it important for soil health and plant growth?","Answer: The document recommends several key practices for improving soil organic matter, which is crucial for soil health and plant growth. These practices include recycling crop residue back to the field, applying compost, using various organic manures, mulching organic wastes, utilizing green manures and cover crops, implementing suitable crop rotation, reducing soil tillage, and avoiding soil erosion. Soil organic matter is important because it provides essential nutrients for soil organisms, acts as a significant reservoir of plant nutrients, facilitates nutrient exchange between soil and plant roots, improves soil structure, influences soil temperature, reduces the risk of soil erosion, and increases the soil's water holding capacity. These benefits collectively enhance the fertility and productivity of the soil, making it more conducive for plant growth and agricultural productivity."
1,"Question: What are the common symptoms of nutrient deficiencies in plants, and how can they impact plant health and development?","Answer: Common symptoms of nutrient deficiencies in plants include chlorosis (yellowing of leaves), necrosis (death of plant tissue), stunted growth, delayed flowering, reduced fruit and seed development, and premature fall of leaves and buds. These symptoms can significantly impact plant health by inhibiting cell division, reducing photosynthesis efficiency, and weakening plant structures, which in turn can lead to decreased crop yields and poor quality of fruits, seeds, and flowers. Nutrient deficiencies such as nitrogen (N), phosphorous (P), potassium (K), calcium (Ca), magnesium (Mg), zinc (Zn), copper (Cu), iron (Fe), boron (B), manganese (Mn), and molybdenum (Mo) each have specific symptoms that can help in their identification. For instance, nitrogen deficiency leads to stunted growth and pale-yellow coloring on older leaves, while potassium deficiency is marked by chlorosis along leaf margins and browning of older leaves. Addressing these deficiencies through proper nutrient management is crucial for maintaining healthy plant growth and maximizing agricultural productivity."
1,"Question: What are the visual symptoms of sulfur deficiency in plants, and how does it affect plant growth and development?","Answer: Sulfur deficiency in plants is characterized by younger leaves turning uniformly yellowish green or chlorotic. This discoloration is a key visual symptom indicating that the plant is not receiving an adequate amount of sulfur, which is essential for chlorophyll production and overall plant health. In addition to the change in leaf color, sulfur deficiency restricts root growth, which can severely impact the plant's ability to absorb water and nutrients from the soil. This limitation on root development can lead to stunted growth and reduced vigor. Furthermore, sulfur deficiency can affect flower production, often making it indeterminate. This means that the plant may not produce flowers at the expected time, or the flowers may not develop properly, which can impact fruit set and overall yield. The deficiency's impact on both vegetative and reproductive growth highlights the importance of sulfur in plant nutrition and the need for timely identification and correction of this deficiency to ensure healthy plant development."
1,"Question: What are the common symptoms of nutrient deficiencies and diseases in wheat, rice, citrus, sugarcane, and cauliflower as outlined in the documentation?","Answer: The documentation outlines various symptoms of nutrient deficiencies and diseases across different crops. In wheat, symptoms include a longitudinal band of white or yellow leaf tissue, progressing to interveinal chlorotic mottling and white to brown necrotic lesions in the middle of the leaf blade, leading to the collapse of affected leaves. Rice plants show small, scattered light yellow spots on older leaves 15-20 days post-transplanting, which later enlarge, merge, and turn deep brown, with the entire leaf becoming rust-brown and drying out within a month. Citrus trees exhibit irregular interveinal chlorosis, with terminal leaves becoming small and narrowed (little-leaf), severely reduced fruit-bud formation, twig dieback, and chlorosis between the veins of young leaves, featuring chlorotic and necrotic spots in the interveinal areas. Sugarcane shows symptoms of ""streak"" disease, with greyish areas near the base of younger leaves turning yellowish to yellow-orange. Molybdenum (Mo) deficiency across various plants causes lower leaves to display chlorotic interveinal mottling, followed by marginal necrosis and leaf infolding. In cauliflower, this deficiency leads to ""whiptail,"" where leaf tissues wither, leaving only the midrib and a few small pieces of the leaf blade. Additionally, a general decline in tree health is described, with early symptoms limited to a few limbs and progressing to affect the entire tree, characterized by sparse mottling leaves, stunted growth, sickly appearance, yellowing of the midrib and lateral veins of old leaves, leaf shedding, twig die-back, and the presence of short twigs with narrow small leaves. Secondary growth consists of short, weak shoots with discolored leaves, excessive flowering, but fruits do not mature and show distinct sun-blotching."
1,"Question: What are the key differences between single nutrient fertilizers, double fertilizers, and complete fertilizers as described in the document?","Answer: Single nutrient fertilizers provide only one of the primary nutrients needed by plants, such as nitrogen (N), phosphorus (P), or potassium (K). An example given is urea, which is a high-nitrogen fertilizer with 46% N content, making it ideal for situations where a significant nitrogen boost is required. Double fertilizers, on the other hand, supply two of the primary nutrients, offering a more balanced nutrition for crops in a single application. Diammonium phosphate is highlighted as a double fertilizer that contains both nitrogen and phosphorus. Complete fertilizers, such as Sampurna and Vijaya Complex, offer a balanced mix of all three primary nutrients (NPK), providing comprehensive soil nutrition in a single product. These fertilizers are formulated to meet the overall nutritional needs of crops, making them suitable for general use in a variety of agricultural settings. The document emphasizes the importance of selecting the right type of fertilizer based on the specific nutrient requirements of the soil and crops, as well as considering factors like potential hazards and application methods to optimize crop nutrition and soil health."
